id,estimate_no,user_dept,type_of_work,subtype_of_work,prepared_user_name,prepared_designation,prepared_position,prepared_department,nature_of_work,description,status,fund,function,budgethead,estimate_amount,project_code,asset_code,asset_category,asset_name,zone,ward,created_name,created_position,created_designation,created_department,owner_name,owner_position,owner_designation,owner_department1,BR/2013-14/36164,BR-Bus Route Roads,Buildings,,AE9NBRR,ASSISTANT ENGINEER,ASSISTANT ENGINEER_548,BR-Bus Route Roads,CAPITAL WORKS -IMPROVEMENT WORKS,"Development of pedestrian way around mylapure temple streets in div-124,in zone-9",REJECTED,,,,32040000,,044/13052/17939/2013-14,BLACK TOPPED INTERIOR ROADS,FOOT PATH,N09,N124,HO ,HEALTH OFFICER_1,HEALTH OFFICER,H-Health,HO ,HEALTH OFFICER_1,HEALTH OFFICER,H-Health2,NC/2014-15/9206,NC-MADHAVARM,ROADS,IRR -RELAYING,AEDN23,ASSISTANT ENGINEER,ASSISTANT ENGINEER_394,NC-MADHAVARM,CAPITAL WORKS - NEW ASSET,STRENGTHININGAND RELAYING OF B T ROAD AI BAJANAI KOIL STREET(PART) IN DN 23 U 6 Z3,ADMIN SANCTIONED,02-CAPTIAL FUND,202107 - Roads and Building Maintenance,412200400-SPECIFIC FUND -COUNCILLOR WARD IMPROVEMENT FUND,795000,05/NC/2851/2014-15,R/21189/1554/2011-12,ROADS AND BRIDGES,bajanai koil street,N03,N023,CIDN123,CONSERVANCY INSPECTOR_430,CONSERVANCY INSPECTOR,NJ-TEYNAMPET,CIDN123,CONSERVANCY INSPECTOR_430,CONSERVANCY INSPECTOR,NJ-TEYNAMPET3,NC/2014-15/7689,NC-MADHAVARM,ROADS,,AEDN31,ASSISTANT ENGINEER,ASSISTANT ENGINEER_401,NC-MADHAVARM,CAPITAL WORKS -IMPROVEMENT WORKS,"LAYING CC ROAD BY RMC AT KANNABIRAN KOIL 1 TO 16 CROSS STREET  IN DIV-31, UNIT-8, ZONE-3.",ADMIN SANCTIONED,02-CAPTIAL FUND,202107 - Roads and Building Maintenance,412200400-SPECIFIC FUND -COUNCILLOR WARD IMPROVEMENT FUND,960000,_05/NC/1912/2014-15,R/20526/2192/2011-12,BLACK TOPPED INTERIOR ROADS,KANNAN NAGAR 1ST & 2ND STREET,N03,N031,AHONZ07,ASSISTANT HEALTH OFFICER_29,ASSISTANT HEALTH OFFICER,NG-AMBATTUR,AHONZ07,ASSISTANT HEALTH OFFICER_29,ASSISTANT HEALTH OFFICER,NG-AMBATTUR4,NC/2014-15/2848,NC-MADHAVARM,Storm Water Drain ,SWD-Maintenance,AEDN26,ASSISTANT ENGINEER,ASSISTANT ENGINEER_330,NC-MADHAVARM,CAPITAL WORKS -IMPROVEMENT WORKS,"DESILTING AND IMPROVEMENTS OF STORM WATER DRAINS IN SOORAPET ST, KAMARAJAR ST, NEHRU ST, PERUMAL KOIL ST, ANNA ST, SATHYAMOORTHY ST, THILAGAR ST, GANDHI ST, SASTRI NAGR 1ST MAIN ROAD, THIRUMALAI NAGAR EXTN MAIN ROAD, THIRUMALAI NAGAR EXTN 1ST MAIN ROAD, IYYAPPA NAGAR, VASANTHA NAGAR, MEJASTIC COLONY, THANIGACHALAM NAGAR F BLOCK 4TH ST, THANIGACHALAM NAGAR F BLOCK 3RD MAIN ROAD, 2ND MAIN ROAD, THIRUMALAI NAGAR 1ST MAIN ROAD, THIRUMALAI NAGAR 3RD MAIN ROAD, 2ND MAIN ROAD, 1ST MAIN ROAD, EAST MAIN ROAD, VAJRAVEL NAGAR MAIN ROAD, VAJRAVEL ST, VAJRAVEL 2ND ST, VAJRAVEL 3RD AND 4TH ST, DEVAKI NAGAR 3RD ST, DEVAKI NAGAR 1ST CROSS ST, DEVAKI NAGAR 2ND ST, DEVAKI NAGAR 1ST ST AND NATARAJ NAGAR IN DIVISION 26 UNIT 7 ZONE 3",ADMIN SANCTIONED,02-CAPTIAL FUND,202107 - Roads and Building Maintenance,412401100-OTHERS-STORM WATER DRAINS AND CULVERTS,170000,_05/NC/0338/2014-15,SD/21333/15/2011-12,SEWARAGE AND DRAINAGE,DRAIN Sathyamoorthy st,N03,N026,AHONZ07,ASSISTANT HEALTH OFFICER_29,ASSISTANT HEALTH OFFICER,NG-AMBATTUR,AHONZ07,ASSISTANT HEALTH OFFICER_29,ASSISTANT HEALTH OFFICER,NG-AMBATTUR5,B/2014-15/0075,RS-Regional office - South,Buildings,,AE13NBLDG,ASSISTANT ENGINEER,ASSISTANT ENGINEER_577,B- BUILDINGS,CAPITAL WORKS - NEW ASSET,"NEW CONSTRUCTION OF DRIVERS REST ROOM IN DIV.175,U-40,Z-13.",ADMIN SANCTIONED,02-CAPTIAL FUND,202800-Buildings,412400502-OTHERS-OFFICE BUILDINGS -ZONAL OFFICE BUILDING,604000,05/B/4831/2014-15,B/13353/688/2013-14,BUILDINGS,additional improvement works,N13,N175,HO ,HEALTH OFFICER_1,HEALTH OFFICER,H-Health,HO ,HEALTH OFFICER_1,HEALTH OFFICER,H-Health6,RS/2014-15/2267,RS-Regional office - South,Foot path,Improvement,AEBRRRS,ASSISTANT ENGINEER,ASSISTANT ENGINEER_803,RS-Regional office - South,Repairs and Maintenance works,"Face lifting and repair works to footpath and centre median at Besent Avenue road, Dr.Muthulakshmi Salai, Kalki Krishnamurthy Salai and Durgabai Deshmuk Road",ADMIN SANCTIONED,02-CAPTIAL FUND,202800-Buildings,412400804 - OTHERS-BLACKTOPPED-TRAFFIC IMROVEMENTS,2400000,05/RS/0459/2014-15,05/RS/0459/2014-15,BUSROUTE ROADS -OTHERS,FOOT PATH,N13,,AHONZ07,ASSISTANT HEALTH OFFICER_29,ASSISTANT HEALTH OFFICER,NG-AMBATTUR,AHONZ07,ASSISTANT HEALTH OFFICER_29,ASSISTANT HEALTH OFFICER,NG-AMBATTUR